"meigara_id","toukou_id","title","created_at","user_name","text"
125,4970,"純米吟醸","2014-03-10 22:13:55","ひなちゃん","久しぶりに飲みました。 飛露喜より香りと甘味は控え目、スッキリした酒質の中に、 柑橘系の酸味を感じます。 前に飲んだ時はここまで酸は無かったような気もします。 余韻の酸を楽しみながら食中酒としてグビっとやりたい。 飛露喜をこの銘柄に求めるのではなく、やはり泉川として飲みたい。"
125,3778,"純米吟醸 ふな口本生","2011-01-03 21:31:00","海くんパパ","県外向けの飛露喜のかすみ酒は品質を安定させるため樽をブレンドしているが、県内向けの泉川はブレンドしないため樽が違うと味が若干違う。 飛露喜が純米で泉川が純吟といった違いはあり、泉川の方が香豊かである。 ひと口目の印象は飛露喜に及ばないものの、量を飲むならこっちの方がいい。 飲み比べすると楽しい。"
125,2276,"菊泉川 普通酒","2008-03-12 09:18:08","鬼酒","飛露喜の蔵の地元酒です。 普通酒でありながら55%精米というスペックですが、流石に吟醸香はありません(笑) 味は綺麗で切れもよく呑み飽きしない辛口ですが、冷やよりお燗酒向けのお酒だと思います。 このお酒は廣木氏自身が楽しむ酒というコンセプトらしいですが、これで一升1680円とは恐れ入ります。"
125,762,"泉川 純米大吟醸","2005-03-29 11:57:43","酒魚菜 なべ駒","香りも高く芳醇なタイプ。軽快に飲める。"
125,761,"泉川 山田錦 吟醸","2005-03-29 11:55:28","酒魚菜 なべ駒","味わい濃い。酸が心地よい。"
125,760,"泉川 ふな口 純米吟醸 生","2005-03-29 11:53:44","酒魚菜 なべ駒","シャープな口当たり、旨味がたっぷり、麹の香りが心地良い。"
125,759,"泉川 純米吟醸","2005-03-29 11:51:53","酒魚菜 なべ駒","香おりおだやかでコクのある深い味わい。"
