"meigara_id","toukou_id","title","created_at","user_name","text"
154,6059,"笑四季 特別純米 Polynesia 生","2016-06-17 21:28:35","富牟谷欠","笑四季 特別純米 Polynesia 生 低アル原酒 ２７ＢＹ 熟れた果実の濃厚な甘酸っぱさを思わせる匂い。立ち香含み香ともに程よく。 含むと甘酸っぱい果実味が全開に弾ける。 転がすと､とろっとコクが出て、甘みに酸と旨みが重なりあう。 キレはやや弱く、ゆるりと余韻。  低アル酒ですが、香味ともに濃厚でインパクトがあります。 レギュラーのシロとクロ（鉄コンみたいｗｗ）と異なり、遊び心満載ですね。 しかし、これがあればモンスーンの立ち位置って。。。"
154,5804,"White特別純米 滋賀県産米50%","2015-12-23 21:28:07","太宰宰","酒店の店員も絶賛してました。一口目フルーティーで飲みやすいし濃いと感じました。生原酒ALC16%なので、アルプス氷のロックで飲みました。奥さんも飲みやすいと飲んでます。一升2200（税抜き）でコスパ良し、蔵元のブログも好感持てます。いいでき、いまいちのできを正直に書かれてます。"
154,5591,"Sensation３ Ｂｌａｃｋ 特別純米黒ラベル 火入れ","2015-07-14 22:56:03","ひなちゃん","タッチは柔らかく完熟した桃の濃厚さ、蜜リンゴのような甘味に 南国果実的な華やかでフルーティーな香りが絡み合って口の中に広がります。 余韻まで甘味が持続し、存分に主張してきますが、 ヒケは酸が登場するので、ダレることなく上手に仕上げてます。 まずは華やかな味わいが好きな人にお勧めしますが、 4合瓶で税込1,188円、かなりＣＰ抜群なんで、誰にでも勧めたいのが本音。"
154,4850,"Sensation 黒ラベル 生","2014-01-04 01:48:26","左党","なんかスカしたネーミングとラベルばっかりの蔵元だなぁ、と思っていたんですが、このラベルには何故か惹かれて購入。 大晦日は仲間とすき焼きで年越しだったので、見た目のウケが良さそうなコイツを持参しました。 香りは少々控え目、生酒らしいフレッシュな酸味とピリピリな微発泡感。すき焼きのクドさに全く負けない、芯がしっかりした上々の美酒でした。しかもリーズナブル。ジャケ買いならぬラベル買い成功です。"
154,4170,"アンタイド ２０１２ ピンク特別純米 無濾過生原酒","2012-02-17 22:00:59","ひなちゃん","立ち香はさほど無いですが、フローラルな含み香が強いですね。 開栓直後はビリビリですが、時間が経つに連れて穏やかな丸みを帯び、好みの味わいになってきます。よく見るとラベルに「ｆｏｒ ｗｏｍｅｎ」とあり、前回飲んだタンジェリンは「ｆｏｒ ｍｅｎ」とあります。 タンジェリンは男性向けでこのピンクは女性向けってとこでしょうか。 大分派手な大人の女性の感じもしますが、これも個性でしょう。 スペックは以下の通り。 麹米：滋賀県信楽町産山田錦精米６０％ 掛米：滋賀県産米６０％ 酵母：笑四季８号"
154,4152,"ＵＮＴＩＥＤ（アンタイド） ２０１２","2012-02-01 22:18:34","ひなちゃん","モンスーンの後にこっちを飲みました。 モンスーンは甘味が前面に出てましたが、 アンタイドはレモンのような柑橘系の酸味が特徴的です。 シュッと締まったシャープさを備えてます。 ん〜、モンスーンとアンタイドのコラボは結構たまらないですね。 アンタイドの裏ラベルに以下記載。 タンジェリン 特別純米 垂口直汲 無濾過生原酒 日本酒界のミッシェル・ガン・エレファントのような ロックな旨さを感じます。"
154,4151,"ＬＡ ＭＯＵＳＳＯＮ（モンスーン特別醸造）","2012-02-01 21:50:28","ひなちゃん","含むと穏やかな酸味と甘味、特に甘味が強いです。 お店の人は貴醸酒って言ってましたのでそのせいかな。 三芳菊と近い方向性を感じますが、 三芳菊はリンゴのようなカプロン酸の甘味を強く感じましたが、 笑四季は甘味の中にイソアミル系のミントハーブのような香りが 鼻にスッと抜け、これが特徴的です。 ラベルには以下記載あります。 ＭＡＮＤＲＡＧＯＲＥ ２０１１β 特別醸造玉栄×ＮＯ．３０酵母 火入熟成 個人的にラベルの絵がシビれました！"
154,4014,"monsoon 3 モンスーン 特別醸造 シャクナゲ酵母 ","2011-08-21 22:46:58","koyamazaki36","かなり甘口で、日本酒とは思えないのど越しと味わい。かすかに日本酒の後味を残す引き具合。 オンザロックは邪道なのだろうが、その飲み方が自分には合っていました。 1週間ほど冷蔵庫で寝かせると、ほとんどグッとくる感じがなくなり甘味とさわやかな芳香が心地よくスルスルとのど越しよく入ってきてしまう。 不思議にまた飲みたくさせる魅力のあるお酒だと思います。 頑固な日本酒通には否定されるかもしれませんが、お酒としてはこれはありだなと思います。 和食よりは洋食の食中酒としてお勧めします。 "
