"meigara_id","toukou_id","title","created_at","user_name","text"
182,6316,"菊正宗 純米酒 香醸 ","2017-02-08 22:47:55","こけこっこ","何でもよかったのだが菊正の純米が目に入ったので買ってみた。 冷やしてと書いてあったので冷やして飲んでみたら、ありゃ、 吟醸香が漂う。おやおやと思い飲んだが一瞬にして味がだれてきて 暖まるにつれて変な匂いがしてきた。最後は臭すぎ。 説明書きに「大吟醸ではありません」と記載しているが そもそも精米は70。吟醸造りではない。香りに自信があってそのような記載なんでしょうけどね。  大吟醸＝良い香りではないと思う。  私的に菊正は普通酒クラスが安心して飲める。"
182,5222,"佳撰","2014-10-14 23:52:51","最近ちょっと飲み疲れで酒の量を減らしている男","辛口寄りではないけど、キクマサ特有の、うっすら樽酒っぽい香りもあり、意外とまろやかで、佳撰といえ、けっこう悪くない。ピンとか辛口パックよりもよっぽどおいしいと思う。但し、それらよりは高いけど。"
182,4957,"本醸造 樽酒","2014-03-05 11:47:15","オクトーバ","樽の香りがする。少し濃い味だが、普通に飲める。"
182,4542,"菊正宗 本醸造 樽酒 225ml","2013-03-11 23:06:20","バックマイ","  吉野杉の樽を使っているらしいです。 杉のいい香りが漂い、菊正宗らしい潔い辛味がありながら、 お米の旨みがしっかり感じられます。  頑張ってますね、菊正宗。"
182,4494,"菊正宗 上撰 生もと辛口純米酒パック 1.8L","2013-01-30 20:36:37","バックマイ","スーパーで1380円で購入。参考小売価格より だいぶお安かったです。ちょっと得した気分。 端麗辛口で、お燗するとよりおいしいと思います。 呑み飽きしない、料理の邪魔をしないという点では、 かなりよくできたお酒ではないかな。 いわゆる『イケるクチ』の方にとっては、毎日の 晩酌の友として、ベターなお酒ではないですかね。 正規の価格も、1800円台と、お財布にやさしいですしね。"
182,4411,"辛口パック900ｍｌ","2012-12-03 00:38:41","最近ちょっと飲み疲れで酒の量を減らしている男","給料前で貧乏でお金が無かったので（いつもの事だが）、仕方なしに買って冷やで呑んだ。うすい。辛口・日本酒度+10とあるが単にうすいだけの印象、香りもヘッタクレもない感じ。菊正上撰とはかなり違う。不味いとまでは思わないが、値段相応かな。"
182,4326,"にごりん","2012-07-01 19:50:29","井坂酒蔵"," ビール（第３のビール）→日本酒、最後は？ 宝缶チューハイでシメめてましたが、最近は・・・。 きっかけは、ソウルマッコリでした。結構美味しい。ただ、アルコール度数が、６%とやや高めなので、シメるには・・・。 そこで、アルコール度数３%の、菊正宗、にごりん、にしてます。乳酸菌のお酒。この酒蔵、生もとにこだわったり、女性が嫌がる日本酒臭さを消すため樽酒をリリースしたり、精力的に開発活動をしてます。私は、にごりん専門ですが、機会があれば是非。パッケージは猫なのは、何故？。"
182,1772,"菊正宗ピン淡麗仕立","2007-05-29 22:40:59","ガンツトロッケン","本年10月からの酒税法改正により大手酒造の三増酒が飲めなくなる可能性が出たので、初めて自分で買って飲んだ。少し接着剤のような立香。お燗にするとほんのり甘酸っぱい。似非吟醸香のような接着剤の香りを引きずりながらも、淡麗で嫌味はない。しかし、飲みにくいお酒ではないものの、旨みはないし楽しくない。イミテーションの典型。結局、1合ほど飲んで残りは料理酒に。蔵元もホームページでこのピンを料理に使う方法を紹介している。料理酒であれば、糖類・酸味料も役立つ。もう飲むことはないでしょう。"
