"meigara_id","toukou_id","title","created_at","user_name","text"
188,5532,"夢山水五割五分 生 夏かすみ吟醸","2015-05-09 16:04:06","すくなびこな","さわやかなラムネ香。 しつこくない甘味と酸味、しっかりした炭酸で、 夏酒にしてはドライな仕上がりです。  ソフトタイプの夏酒では物足りない貴兄に。"
188,4973,"夢山水十割 生","2014-03-13 20:20:10","みのる"," 私は今までいわゆる淡麗辛口のお酒を愛飲していました。でもふと、その逆ってどんな酒なんだろうと思い紹介されたのがコレ。  あまり香りがしないので本当にコレ吟醸なの？と思ったんですが･･･ 口の奥から鼻に抜ける香りがすごく濃厚！口に入れた瞬間ブワッという吟醸とはまた別の心地よさがありますね！味も濃い！  買った時は辛口の反対で甘口なのかなと思っていたんですが、淡麗の反対で超濃厚とは予想外でした。 どれだけ濃口で脂っこい料理にも負けないお酒です。銘柄の通り、日本酒の奥深さを思い知らされましたね。"
188,4299,"若 夢山水 十割","2012-06-04 22:35:13","すくなびこな","夢山水も、季節により４種類あるようです。 そのうちの「若」  ほかの皆さんがおっしゃっているように、「濃い」です。 １８．５度ですが、２０度くらいあるように感じます。  甘味もあり、ちょっと焼酎みたいな感じです。"
188,4292,"純米吟醸 生原酒 夢山水十割","2012-05-25 21:57:18","ひなちゃん","裏ラベルには出来るだけ濃い酒を目指したとのこと。 確かに含むとトロッとした質感、メープルシロップ、ライチのような甘味も 感じるのですが、それ以上に余韻の力強い酸が印象的です。 アルコール度数１８．５度なんで、 じっくり味わっている内に酔いが回ってしまう(笑)。 ストレート・ピュアと言うよりは複雑で妖艶な味わいかな。 肉系の料理と合わせてみたい。 濃くて甘い、クセになる人はクセになる味わいかと思います。"
188,2535,"奥 夢山水 十割","2008-06-02 12:50:33","冷たい奴","知らない銘柄で、酒米「夢山水」も聞いたことなかったが、ラベルのデザインで即購入。いきつけの酒屋の店主が濃くて美味しいよとの言葉通り…とても濃い。華やかな香りとトロリ甘く濃い味わいが同居する、初めて経験する味。ハチミツやメープルシロップを想わせる甘みが強く、余韻も非常に長い。食後酒として楽しめる面白い酒です。"
188,1969,"奥 夢山水 十割 ","2007-10-24 09:08:24","花奴","冬絞りたての時期に頂きましたが かなり熟成された感じがしました。 生→若→旬→熟 と四季通してどんな味わいに変わるか楽しみなお酒です。  口に含んだあと 喉を通すまで 時間がかかりそうなくらい 濃い感じがあります。絞りたての生でその感覚でしたから、1年経過した熟は凄いトロトロ感なのかな？"
188,1737,"奥 夢山水 浪漫","2007-05-16 03:52:01","Lysine","私の地元、愛知県の日本酒。 夢山水という地元の酒米を使っており、この酒米のためかそれとも製法のためなのかわからないがとても力強い味わいの日本酒である。 その独特の雰囲気を例えるなら「戦国時代に、負け戦になるとわかりながら戦に挑む武士が合戦前夜に最後に飲む酒」という感じです（わかりにくい例えですみません） ローカルな日本酒であまり目にすることはないですがもし見つけたらぜひ試してみてください。 合戦前夜の武士の気持ちになれるかも？！  "
188,1293,"純米大吟醸 原酒","2006-07-16 00:05:59","うめきち","愛知の新種米｢夢山水｣で仕込んだお酒は、蓬莱泉の一部商品とこの｢奥｣だけで、夢山水を味わうにはもってこいです。 ４合瓶で２３００円と安価ながら、香りは高く、それでいて味わいは濃いとゆう難しい課題をクリアしたいとゆう造り手の願い通り、深い味わいになっていると思います。  今度は蓬莱泉の定番商品ではなく、関谷醸造さんで直接つめてもらった夢山水のお酒と比べてみたいと思いまーす （＾Θ＾）♪ 個人的にはかなりお買い得かと…"
