"meigara_id","toukou_id","title","created_at","user_name","text"
97,4870,"鹿児島で日本酒「三千盛のにごり酒」","2014-01-11 23:38:31","しげぴょん","鹿児島といえば焼酎文化ですが実は日本酒やワインなどにも力を入れている酒屋もあります。魚も肉も野菜も美味しいところではありますが、料理自体は焼酎に合うような品が多いです。私は大の日本酒好きですので何とか鹿児島の肴に合う日本酒はないものかと上に書いた酒屋にて「三千盛のにごり酒」を購入。 香最高！甘い香、口に含むと「おっ、」「わずかに酸味、でも後味さっぱり」。 どぶろくのようなキツイ酸味はないですね。和風ヨーグルト？さつま揚げや豚の角煮にも合いそうです。"
97,4568,"超特 からくち","2013-04-03 00:52:45","左党","スペックは大吟醸(非純米)、日本酒度＋15の超辛口です。口に含むとまずアルコールっぽさが広がり、香りや旨味は控えめ。ただし、その前にかなり濃厚な槽場詰めの生原酒を呑んだ影響もあるかも。"
97,3014,"悠醸","2009-03-06 18:12:37","酔人２８号","岐阜に行った帰りに買いました。 香りはフルーティーでいかにも吟醸酒って香り。 口当たりは酵母が生きてたのかかすかに弾けるというか弾む 感じとても上品でよい。 滑らかで、甘すぎず、辛過ぎずバランスが非常に良かった。 後味も嫌味が無く綺麗でした。 丁寧に造られてることが素人でも分かる良い酒。"
97,2244,"三千盛純米酒","2008-03-10 03:32:54","やまおか しろう","最初に飲んでいる時は、水のように軽い酒と感じてしまうが、長いこと飲んでいると旨味を感じてきます。 いっぱい飲んでしまう。 淡麗辛口のいい酒です。"
97,2043,"美濃・多治見の蔵元","2007-12-21 21:47:38","うり坊","岐阜県在住で地元の蔵元にそれなりにこだわりを持っていますが、私見では県内で一番うまい酒ではないかと思っています。 季節限定のにごり酒、辛口で知られるこの蔵元らしい面白い味です。 酒が生きていることがわかります。"
97,1184,"三千盛 朋醸","2006-03-26 14:50:02","Sweet Bridge","熟成させたお酒だということで買ってみました。 開封したてのときは、杉のような木の香りが強すぎそんなに好きになれなかったのですが、１ヶ月ほどたつと香りがいい具合に落ち着いてきて、味もまろやかになりました。けっこう美味しい酒です。"
97,67,"笠原の坂の上の作り酒屋さん","2003-10-17 17:34:00","名古屋のリラン","２０歳の頃（２３年前）、限られた地域にしかなく笠原町のこの造り酒屋さん迄購入に行きました。頂いた時の風味の良さときりっとした辛口の口当たりに驚きを覚えそれ以来のファンです。今では地元でも購入が出来、多治見から山の中へ行っての購入はなくなりましたが、機会があったら伺いたいものです。"
